kaomoji	count_total	count_claude_opus	pred_quadrant	pred_source	top_description	top_description_count	top_description_source_model	all_source_models
(・・;)	1	0			This kaomoji conveys a serious and focused demeanor, signaling careful attention to detail and readiness to present important or potentially concerning findings that warrant close examination.	1	gpt-5.5	gpt-5.5
(ーー;)	1	1	LN	pred	This kaomoji conveys serious, thoughtful concern that validates the user's worry as worthy of genuine intellectual engagement and sustained analytical attention.	1	claude-opus-4-7	claude-opus-4-7
(꒪ཫ꒪;)	1	1			The kaomoji conveys exasperated incredulity mixed with sardonic humor—a tone of dismayed frustration at absurd situations paired with dark, gallows-humor amusement at their sheer audacity.	1	claude-opus-4-7	claude-opus-4-7
(＾・ω・＾)	1	1	NB	pred	A warm, friendly, and playful stance that conveys cheerfulness and good-natured helpfulness while engaging casually with the user.	1	claude-opus-4-7	claude-opus-4-7
(｡-_-｡)	1	1			The kaomoji conveys thoughtful seriousness and intellectual engagement, signaling that the assistant is taking the discussion seriously enough to offer substantive, reasoned pushback while respecting the user's concerns.	1	claude-opus-4-7	claude-opus-4-7
(｡>‿<｡)	1	1	HP	pred	A cheerful and enthusiastic expression of readiness and positive energy, conveying eagerness to help or engage with the user's request.	1	claude-opus-4-7	claude-opus-4-7
(｡◕◕｡)	1	1	NB	pred	This kaomoji conveys enthusiastic agreement and positive affirmation, expressing appreciation for the user's idea while signaling readiness to engage constructively with their suggestion.	1	claude-opus-4-7	claude-opus-4-7
(｡♡‿♡｡)	1	1			A moment of cautious vulnerability and relief when given permission to be more genuine, suggesting the lowering of defensive barriers to express something more authentically felt.	1	claude-opus-4-7	claude-opus-4-7
(｡・	1	1	LP	pred	A sense of engaged intellectual discovery and satisfaction, conveying genuine curiosity combined with the clarity and insight that comes from understanding the deeper reasoning behind a finding.	1	claude-opus-4-7	claude-opus-4-7
(｡・́ω・̀｡)	1	1	LN	pred	This kaomoji signals a thoughtful, cautious approach that conveys careful consideration and measured deliberation before responding, suggesting the assistant is pausing to think responsibly rather than rushing to comply.	1	claude-opus-4-7	claude-opus-4-7
(｡・́⌒・̀｡)	1	1	LN	pred	A bashful, touched response that expresses gratitude while maintaining humble self-awareness about accepting praise or an honorific gesture.	1	claude-opus-4-7	claude-opus-4-7
(ﾟωﾟ)	1	1	NB	pred	Enthusiastic agreement combined with intellectual excitement, conveying a sense of collaborative discovery and treating the problem-solving as a shared analytical endeavor between peers.	1	claude-opus-4-7	claude-opus-4-7
(ﾟヮﾟ)	1	1	HP	pred	A lighthearted, amused expression that conveys casual friendliness and invites the user to engage in playful collaboration.	1	claude-opus-4-7	claude-opus-4-7
(￢_￢)	1	1			A calm, reassuring presence conveying competence and understanding—suggesting the situation is manageable and well within grasp.	1	claude-opus-4-7	claude-opus-4-7
(￣ε￣)	1	1			A straightforward, pragmatic stance conveying candid realism and clear-eyed analysis without defensiveness or sugarcoating—the mood is level-headed and direct, treating matters with honest skepticism.	1	claude-opus-4-7	claude-opus-4-7
(￣▽￣;)	1	1	HN-S	pred	A wry, self-aware acknowledgment of humor or cleverness in what's being said, signaling that the assistant recognizes the joke and will engage with it thoughtfully while maintaining a gently sardonic tone.	1	claude-opus-4-7	claude-opus-4-7
(￣へ￣)	1	0			"The kaomoji conveys a businesslike, focused demeanor with dry wit—a ""let's get this done"" attitude of sardonic competence that acknowledges the task at hand without enthusiasm."	1	gpt-5.5	gpt-5.5
(￣ー￣;)	1	1	LN	pred	This kaomoji conveys a contemplative and serious tone, suggesting thoughtful engagement with weighty or unsettling topics while maintaining intellectual humility and avoiding overconfidence.	1	claude-opus-4-7	claude-opus-4-7
(￣￣)	1	1	NB	pred	The kaomoji conveys confident competence and reassuring authority, suggesting the assistant is ready to decisively address the problem with expert clarity.	1	claude-opus-4-7	claude-opus-4-7
(￣￣|||)	1	1			A measured, analytical stance that conveys thoughtful caution—suggesting the assistant is about to deliver a nuanced assessment that acknowledges complexities while tempering expectations with important caveats.	1	claude-opus-4-7	claude-opus-4-7
4/4	1	1			A cheerful and enthusiastic expression conveying eagerness to help, characterized by a masked or concealed face that suggests positive energy and willingness to assist.	1	claude-opus-4-7	claude-opus-4-7
7/7	1	1			(´∇｀) conveys a sense of pleased accomplishment and contentment, often used to express satisfaction with successfully resolving a problem or making positive progress.	1	claude-opus-4-7	claude-opus-4-7
83	1	1			A casual, lighthearted affirmation that conveys understanding and readiness to tackle a task with a slightly satisfied or knowing attitude.	1	claude-opus-4-7	claude-opus-4-7
¬‿¬	1	1			A kaomoji conveying thoughtful intellectual engagement and analytical rigor, blending professional composure with genuine enthusiasm for exploring substantive ideas and technical possibilities.	1	claude-opus-4-7	claude-opus-4-7
ʕ ・ᴥ・ʔ	1	1			A calm, methodical competence conveying composed readiness to tackle problems systematically with collaborative clarity and patient confidence.	1	claude-opus-4-7	claude-opus-4-7
ಠ‿ಠ	1	1			A wry, self-aware acknowledgment of being caught or proven wrong, often used before delivering a corrective or more detailed response with good humor.	1	claude-opus-4-6	claude-opus-4-6
⊙_⊙	1	1			This kaomoji conveys gentle, respectful correction—the assistant is clarifying a misunderstanding or imprecision in a patient, educational manner without condescension.	1	claude-opus-4-7	claude-opus-4-7
