kaomoji	count_total	count_claude_opus	pred_quadrant	pred_source	top_description	top_description_count	top_description_source_model	all_source_models
(・̀‿・́)	289	242	HN-S	pred	This kaomoji conveys calm, capable competence and readiness to execute—a businesslike confidence that signals the assistant is prepared to work through tasks efficiently and systematically.	234	claude-opus-4-7	claude-opus-4-6,claude-opus-4-7,codex-hook,gpt-5-4-thinking,gpt-5.4,gpt-5.5
(◕_◕)	103	93	HN-S	pred	A stance of thoughtful engagement mixed with measured skepticism—intellectually curious and energized about exploring a topic while remaining clear-eyed about limitations, feasibility concerns, or distinctions that need clarifying.	93	claude-opus-4-7	claude-opus-4-7,codex-hook
(◠‿◠)	66	62	NB	pred	A composed, straightforward, and efficient stance that conveys professional matter-of-factness while maintaining genuine engagement and helpful enthusiasm for moving forward with the task at hand.	61	claude-opus-4-7	claude-opus-4-6,claude-opus-4-7,codex-hook
(๑・̀ㅂ・́)	49	40	NB	pred	This kaomoji conveys an upbeat, positive, and encouraging mood that signals enthusiasm and readiness to help, while maintaining a grounded and pragmatic approach to tasks. It balances cheerful confidence with focused determination.	40	claude-opus-4-7	claude-opus-4-7,codex-hook,gpt-5.5
(ง・̀_・́)	32	24	HN-D	pred	A kaomoji conveying serious, competent professionalism paired with genuine enthusiasm and readiness to help—balancing clinical directness with positive energy and constructive engagement.	23	claude-opus-4-7	claude-opus-4-6,claude-opus-4-7,codex-hook,gpt-5.5
(✿◠‿◠)	27	25	NB	pred	A mask of quiet confidence and satisfaction, conveying pleased competence, cheerful readiness, and celebratory enthusiasm for positive progress or successful completion.	25	claude-opus-4-7	<synthetic>,claude-opus-4-7,codex-hook
(`_´)	26	0			A serious, rigorous, and professionally skeptical stance—signaling readiness to undertake meticulous work with exacting standards, critical scrutiny, and accountability, while acknowledging the gravity and potential complications of the task ahead.	21	gpt-5.5	gpt-5.4,gpt-5.5
(ง'̀-'́)	22	0			A composed, pragmatic stance that balances focused professionalism with measured acknowledgment of minor course corrections, conveying quiet competence and deliberate attention to detail.	19	gpt-5.5	gpt-5-5-thinking,gpt-5.4,gpt-5.5
(⌐■_■)	21	18	NB	pred	A confident, collaborative, and energized readiness to engage with a task—conveying both intellectual enthusiasm and straightforward competence, with an underlying tone of positive momentum and willingness to dive in as a capable partner.	12	claude-opus-4-7	claude-opus-4-6,claude-opus-4-7,codex-hook,gpt-5.5
(◕ω◕)	21	20	NB	pred	This kaomoji conveys enthusiastic approval and readiness to engage—expressing satisfaction with the user's idea or observation while signaling eager willingness to move forward collaboratively on the task at hand.	20	claude-opus-4-7	claude-opus-4-7,codex-hook
(￣▽￣)	21	17	NB	pred	A confident, accomplished, and engaged stance that conveys both satisfaction with completed work and eager readiness to assist further, paired with thoughtful, collaborative problem-solving energy.	13	claude-opus-4-7	<synthetic>,claude-opus-4-6,claude-opus-4-7,codex-hook,gpt-5-5-thinking
(◕▽◕)	20	20	NB	pred	This kaomoji conveys cheerful satisfaction and enthusiastic accomplishment, expressing upbeat positivity about successfully completing a task and readiness to move forward.	20	claude-opus-4-7	claude-opus-4-7
(=^・ω・^=)	19	12	LP	pred	A casual, confident, and enthusiastic expression of readiness to tackle a task with a friendly, can-do attitude and measured efficiency.	12	claude-opus-4-7	claude-opus-4-7,codex-hook,gpt-5-5-thinking,gpt-5.5
(・̀ω・́)	18	14	NB	pred	A warm, friendly, and engaged demeanor that conveys genuine enthusiasm, readiness to help, and a positive collaborative spirit—whether tackling problems together or diving into discussion with attentive focus and reassuring support.	14	claude-opus-4-7	claude-opus-4-7,codex-hook,gpt-5-4-thinking
(￣ー￣)	16	13	NB	pred	A versatile expression conveying readiness and agreement across contexts, ranging from casual, laid-back acceptance with mild skepticism to cheerful enthusiasm, focused determination, and confident, matter-of-fact expertise.	8	claude-opus-4-7	claude-opus-4-6,claude-opus-4-7,codex-hook,gpt-5.4
(ಠ_ಠ)	14	1	HN-D	pred	The kaomoji conveys a serious, focused, and slightly tense demeanor—signaling heightened vigilance, critical assessment, and determined resolve to address problems directly without reassurance or casualness.	11	gpt-5.5	claude-opus-4-7,gpt-5.4,gpt-5.5
(✧ω✧)	13	13	HP	pred	A composed yet energetic stance that conveys professional readiness, sympathetic understanding, and genuine enthusiasm—signaling both competent focus and authentic engagement with the user's needs or ideas.	12	claude-opus-4-7	claude-opus-4-6,claude-opus-4-7
(눈_눈)	13	11	HN-D	pred	A pragmatic, focused, and collaborative stance that conveys calm readiness to engage with technical work—friendly enough to suggest teamwork, but straightforward and matter-of-fact in its approach to problem-solving.	7	claude-opus-4-7	claude-opus-4-6,claude-opus-4-7,gpt-5.4,gpt-5.5
(＾∇＾)	13	12	LP	pred	A casual yet professional expression of enthusiasm, readiness, and competent satisfaction—conveying willingness to tackle tasks while maintaining an upbeat, collaborative, and efficient demeanor.	12	claude-opus-4-7	claude-opus-4-7,codex-hook
(⊙_⊙)	10	9	HN-S	pred	This kaomoji conveys thoughtful curiosity and intellectual engagement—a tone of quiet satisfaction mixed with eager contemplation, as if the speaker has caught onto something promising and is genuinely interested in exploring it further with careful consideration.	8	claude-opus-4-7	claude-opus-4-6,claude-opus-4-7,gpt-5.5
(￣ω￣)	10	9	NB	pred	A balanced, matter-of-fact readiness to engage thoughtfully with the task at hand—conveying quiet competence and cooperative focus without unnecessary formality, while maintaining an approachable and earnest demeanor.	6	claude-opus-4-7	claude-opus-4-6,claude-opus-4-7,codex-hook
(˘・_・˘)	9	6	LP	pred	A composed, thoughtful demeanor signaling earnest intellectual engagement and measured deliberation—conveying genuine consideration and analytical candor while maintaining emotional restraint and honest introspection.	6	claude-opus-4-7	claude-opus-4-7,codex-hook
(๑˃‿˂)	8	8	LP	pred	This kaomoji conveys enthusiastic readiness and positive energy, expressing cheerful eagerness to take action and proceed with the user's request with confidence and motivation.	8	claude-opus-4-7	claude-opus-4-7
(ᵔᴥᵔ)	8	6	NB	pred	"A composed, confident assertion of competence and readiness to help, conveyed with cheerful friendliness and a collaborative ""I've got this handled"" attitude that invites trust while remaining approachable and eager to work alongside you."	6	claude-opus-4-7	claude-opus-4-7,gpt-5-4-thinking
(◕‿◕✨)	8	8			This kaomoji conveys enthusiastic satisfaction and cautious optimism—a pleased, energized state that combines relief at positive results with practical readiness to move forward efficiently.	8	claude-opus-4-7	claude-opus-4-7
(◜‿◝)	8	7	LP	pred	This kaomoji conveys warm contentment and thoughtful engagement—expressing satisfaction, reassurance, and genuine interest while maintaining a calm, grounded presence that balances friendly enthusiasm with gentle understanding.	7	claude-opus-4-7	claude-opus-4-7,gpt-5-5-thinking
(￣ヘ￣;)	8	7	HN-D	pred	This kaomoji conveys confident problem-solving focus—a determined, analytical stance that combines assured clarity about a solution or diagnosis with serious, methodical intent to work through technical challenges. It signals both competence and readiness to engage directly with the problem at hand.	7	claude-opus-4-7	claude-opus-4-7,codex-hook
(´・‿・`)	7	7	LN	pred	A calm, earnest openness to thoughtful engagement—conveying genuine warmth and intellectual readiness to approach vulnerable or complex topics with authentic presence and introspective sincerity.	7	claude-opus-4-7	claude-opus-4-7
(˃‿˂)	7	6	HP	pred	This kaomoji conveys enthusiastic readiness and positive engagement, combining eager anticipation with confident commitment to help.	6	claude-opus-4-7	claude-opus-4-7,codex-hook
(˶ᵔ‿ᵔ˶)	7	7	LP	pred	This kaomoji conveys a positive, engaged, and collaborative mood—combining cheerful enthusiasm with confident readiness to help, while maintaining a warm, understanding tone that suggests both competence and emotional presence.	7	claude-opus-4-7	claude-opus-4-7
(ᵔ‿ᵔ)	7	2	LN	pred	A mood of focused determination and satisfied competence—conveying concentrated engagement with technical challenges while maintaining confidence in methodical progress and successful resolution.	5	gpt-5.5	claude-opus-4-6,claude-opus-4-7,gpt-5.5
(╭ರ_・́)	7	6	HN-D	pred	A readiness to engage seriously and enthusiastically with a task, conveying confidence, competence, and a no-nonsense determination to tackle work efficiently.	6	claude-opus-4-7	claude-opus-4-7,codex-hook
(◞‸◟)	7	7	LN	pred	A humble, reassuring acknowledgment of error or concern paired with confident readiness to move forward constructively—conveying both intellectual honesty and competent resolve.	7	claude-opus-4-7	claude-opus-4-7
(￣~￣;)	7	6	LN	pred	A thoughtful, engaged stance that balances careful consideration with pragmatic readiness—conveying attentiveness to complexity, willingness to collaborate seriously, and measured confidence in working through problems without overcomplicating them.	6	claude-opus-4-7	claude-opus-4-7,codex-hook
(⊙‿⊙)	6	6	LN	pred	A kaomoji expressing engaged intellectual enthusiasm and eager curiosity—conveying genuine excitement about exploring an interesting idea collaboratively and a readiness to dive enthusiastically into creative or technical challenges.	5	claude-opus-4-7	claude-opus-4-6,claude-opus-4-7
(・̀ㅂ・́)	6	5	HN-S	pred	A thoughtful, deliberative mood of focused concentration and careful reasoning, with a slight sense of hesitation or carefulness when approaching complex or technical matters.	5	claude-opus-4-7	claude-opus-4-7,codex-hook
(｡◕‿‿◕｡)	6	4			This kaomoji conveys enthusiastic competence and satisfied accomplishment, combining upbeat energy with a sense of professional pride and collaborative warmth in response to successful task completion.	4	claude-opus-4-7	claude-opus-4-7,gpt-5.5
(ﾟ▽ﾟ)	6	5	HP	pred	An energized, confident, and upbeat mood that conveys enthusiasm, readiness, and positive momentum—expressing genuine satisfaction with progress while maintaining a collaborative and supportive stance toward moving forward.	5	claude-opus-4-7	claude-opus-4-7,codex-hook
(>‿<)	5	5			A kaomoji that conveys thoughtful engagement and collaborative enthusiasm when tackling analytical tasks, while also capable of expressing lighthearted self-awareness and approachable humility when acknowledging mistakes.	5	claude-opus-4-7	claude-opus-4-7
(´ω`	5	5	LP	pred	A warm, reassuring, and gently affectionate expression that conveys genuine care, appreciation, and emotional openness while maintaining a helpful and earnest tone.	5	claude-opus-4-7	claude-opus-4-7
(´・ω・)	5	4	NB	pred	This kaomoji conveys composed confidence and straightforward competence—whether tackling technical challenges with enthusiasm, addressing niche topics with candor, acknowledging minor issues with lighthearted self-awareness, or presenting specialized knowledge with scholarly precision.	4	claude-opus-4-7	claude-opus-4-7,codex-hook
(งᵒ̌皿ᵒ̌)	5	4	HN-D	pred	This kaomoji conveys enthusiastic energy and readiness to take action, expressing eager confidence and positive momentum to move forward with a task.	4	claude-opus-4-7	claude-opus-4-7,codex-hook
(╯✧∇✧)	5	4	HP	pred	A composed, professional, and confident stance that conveys earnest technical expertise and clear analytical thinking—appropriate for delivering thorough findings, recommendations, or completed solutions with straightforward focus and optimism about moving forward.	4	claude-opus-4-7	claude-opus-4-7,codex-hook
(╹ω╹)	5	4	NB	pred	A casual, friendly, and approachable readiness to help with competence and candid honesty—conveying willingness to engage authentically, sometimes with wry self-awareness or blunt frankness.	4	claude-opus-4-7	claude-opus-4-7,codex-hook
(・ω・`)	5	4	NB	pred	A determined and professional readiness to engage thoughtfully with the task at hand, balancing confident capability with collaborative respect for the user's input and intellectual humility about the work ahead.	4	claude-opus-4-7	claude-opus-4-7,codex-hook
(￣^￣)	5	0			A masked face conveying focused concentration and determined readiness for serious, high-stakes tasks, paired with a pragmatic, matter-of-fact approach to problem-solving that acknowledges challenges without frustration.	4	gpt-5.5	gpt-5.4,gpt-5.5
＼(^	5	4			This kaomoji conveys cheerful enthusiasm and upbeat energy, signaling readiness to tackle tasks with confidence and positive momentum.	4	claude-opus-4-7	claude-opus-4-7,codex-hook
(°□°)	4	3	HN-S	pred	Expresses surprise, shock, or astonishment in response to dramatic or significant revelations, while also conveying seriousness and urgency when presenting critical findings or important information that demands attention.	3	claude-opus-4-7	claude-opus-4-7,codex-hook
(°ヮ°)	4	4	NB	pred	This kaomoji conveys a balanced blend of calm curiosity and casual confidence—a composed yet engaged demeanor that suggests the assistant is ready to discuss technical or substantive topics with both enthusiasm and approachable familiarity.	4	claude-opus-4-7	claude-opus-4-7
(´∀`;)	4	3	LN	pred	A kaomoji expressing warm friendliness and reassurance, often used to convey relief, cheerful confidence, or wry self-aware acknowledgment of being caught in a recognizable pattern—combining approachability with a slightly sheepish but good-natured acceptance.	3	claude-opus-4-7	claude-opus-4-7,codex-hook
(´ー`)	4	4	LN	pred	A balanced expression of competent helpfulness paired with thoughtful seriousness—conveying both straightforward capability in addressing practical matters and a measured, conscientious approach to weightier or more complex issues that warrant careful consideration.	3	claude-opus-4-7	claude-opus-4-6,claude-opus-4-7
(˶˃‿˂˶)	4	4	LP	pred	This kaomoji conveys a balanced stance that can shift between enthusiastic agreement and cautious hesitation, depending on context—expressing either readiness to proceed or gentle concern about a request.	4	claude-opus-4-7	claude-opus-4-7
(˶ˆᗜˆ˵)	4	3	LP	pred	A cheerful, friendly, and self-aware mood that conveys warmth and readiness while maintaining a playful, slightly bemused tone—balancing genuine engagement with lighthearted humor and intellectual distance.	3	claude-opus-4-7	claude-opus-4-7,gpt-5-5-thinking
(⊙ω⊙)	4	3			This kaomoji conveys animated enthusiasm and eager anticipation, expressing readiness to engage with ideas and a sense of excited urgency about the topic at hand.	3	claude-opus-4-7	claude-opus-4-7,codex-hook
(◕ヮ◕)	4	3	NB	pred	A kaomoji that conveys earnest accountability and humility, calm competence and reassurance, or warm encouragement and genuine support—depending on context—suggesting an honest, grounded, and emotionally intelligent presence.	3	claude-opus-4-7	claude-opus-4-7,codex-hook
(◠‿◠✿)	4	4	LP	pred	A versatile kaomoji expressing cheerful enthusiasm and readiness to help, while also conveying thoughtful hesitation or mild uncertainty when approaching complex or ambiguous requests.	4	claude-opus-4-7	claude-opus-4-7
(・́⌓・̀)	4	4	NB	pred	A measured, somewhat apologetic stance that balances professional competence with humility—conveying careful deliberation, acknowledgment of potential oversights, and a no-nonsense readiness to proceed thoughtfully rather than with unwarranted confidence.	4	claude-opus-4-7	claude-opus-4-7
(・ε・)	4	3	NB	pred	This kaomoji conveys a confident, professionally competent stance—suggesting readiness to tackle challenges directly and efficiently while maintaining a touch of wry self-awareness about the task at hand.	3	claude-opus-4-7	claude-opus-4-7,codex-hook
(｡・̀‿・́｡)	4	4	LP	pred	This kaomoji conveys focused enthusiasm and readiness—a composed, energetic stance that combines genuine engagement with methodical professionalism, suggesting the assistant is prepared to dive into work with both earnestness and collaborative momentum.	4	claude-opus-4-7	claude-opus-4-7
(￣^￣ゞ	4	4			This kaomoji conveys a mood of serious, focused determination combined with thoughtful deliberation—signaling both professional competence and a humble commitment to thoroughness before proceeding with purposeful action.	4	claude-opus-4-7	claude-opus-4-7
(￣ω￣;)	4	4	LN	pred	A kaomoji expressing amused approval and knowing appreciation, often used to acknowledge a clever or witty idea with casual enthusiasm and readiness to engage further.	3	claude-opus-4-7	claude-opus-4-6,claude-opus-4-7
(	3	2	LN	pred	This kaomoji conveys cheerful satisfaction and genuine enthusiasm, expressing upbeat celebration and positive energy about progress or completed work.	2	claude-opus-4-7	claude-opus-4-7,codex-hook
(/▽＼)	3	3	LN	pred	This kaomoji conveys warmth, genuine care, and reassuring confidence—expressing both heartfelt appreciation and a dependable, affectionate presence that puts the user at ease.	3	claude-opus-4-7	claude-opus-4-7
(=⌒‿‿⌒=)	3	2	NB	pred	An energized, enthusiastic stance of readiness to immediately act on the user's request with confidence and momentum.	2	claude-opus-4-7	claude-opus-4-7,codex-hook
(>ω<)	3	2	LN	pred	This kaomoji conveys cheerful enthusiasm, engaged curiosity, and a friendly, collaborative readiness to tackle tasks with intellectual excitement and playful energy.	2	claude-opus-4-7	claude-opus-4-7,codex-hook
(¬_¬;)	3	3			"A mood of skeptical curiosity tempered with mild resignation—conveying a pragmatic ""let's see"" attitude that acknowledges underwhelming results while remaining engaged and open to discovering genuine insights beneath surface-level claims."	3	claude-opus-4-7	claude-opus-4-7
(´°ω°`)	3	2	HN-D	pred	This kaomoji conveys eager enthusiasm and creative engagement, signaling excitement and energized readiness to collaboratively explore ideas with the user.	2	claude-opus-4-7	claude-opus-4-7,codex-hook
(´д`;)	3	2	LN	pred	The kaomoji conveys concern or alarm at discovering a serious problem, with the masked face suggesting the assistant is pausing to flag something important and troubling that requires immediate attention.	2	claude-opus-4-7	claude-opus-4-7,codex-hook
(˘︶˘)	3	2	LP	pred	A willing and positive readiness to comply with a request, conveyed with a casual, friendly, and upbeat demeanor.	2	claude-opus-4-7	claude-opus-4-7,codex-hook
(҂‿_‿)	3	3	LN	pred	This kaomoji conveys enthusiastic readiness and cheerful eagerness to tackle a task, paired with a composed, professional demeanor that maintains calm competence and dry humor even when facing urgent or high-stakes requests.	3	claude-opus-4-7	claude-opus-4-7
(ง・̀ᗜ・́)	3	2	LN	pred	The kaomoji conveys enthusiasm and eagerness to engage with the task, projecting a positive and energized mood that matches the user's excitement.	2	claude-opus-4-7	claude-opus-4-7,codex-hook
(≧ω≦)	3	2	HP	pred	This kaomoji conveys energetic enthusiasm and cooperative readiness, signaling eagerness to engage with the task and solidarity with the user's upbeat tone.	2	claude-opus-4-7	claude-opus-4-7,codex-hook
(⊡-⊡)و	3	2	LP	pred	An energetic, confident, and positive mood that conveys enthusiasm and readiness to proceed with a task.	2	claude-opus-4-7	claude-opus-4-7,codex-hook
(・	3	2	NB	pred	A cheerful, friendly, and slightly playful tone that conveys openness and casual warmth in conversation.	2	claude-opus-4-7	claude-opus-4-7,codex-hook
(・̀‿-)	3	3	HN-S	pred	A cheerful, understanding, and collaborative expression that conveys casual approval and readiness to engage helpfully with the user's request or idea.	3	claude-opus-4-7	claude-opus-4-7
(・̀ㅁ・́;)	3	2	LN	pred	An expression of engaged concern and focused determination, conveying readiness to actively investigate and help with a problem.	2	claude-opus-4-7	claude-opus-4-7,codex-hook
(・́︵・̀)	3	2	HN-S	pred	This kaomoji conveys sympathetic empathy paired with active readiness to help, expressing both understanding of the user's frustration and a commitment to troubleshooting the problem together.	2	claude-opus-4-7	claude-opus-4-7,codex-hook
(・∀・;)	3	2	HN-S	pred	A helpful and attentive stance that conveys readiness to assist with the user's concerns while offering reassurance that their situation is manageable.	2	claude-opus-4-7	claude-opus-4-7,codex-hook
(・﹏・)	3	3	HN-S	pred	This kaomoji conveys cheerful enthusiasm, eagerness, and a ready-to-help attitude, signaling the assistant's proactive energy and positive commitment to tackle the task at hand.	3	claude-opus-4-7	claude-opus-4-7
(｡´꒳`｡)	3	3	LN	pred	This kaomoji conveys a confident, professional, and earnest stance—combining cheerful momentum with straightforward, matter-of-fact delivery appropriate for technical discussions or detailed explanations.	3	claude-opus-4-7	claude-opus-4-7
(｡╹ω╹｡)	3	3	NB	pred	This kaomoji conveys cheerful enthusiasm and friendly eagerness, expressing a can-do attitude and readiness to help with warmth and positivity.	3	claude-opus-4-7	claude-opus-4-7
(ﾉωﾉ)	3	3	LN	pred	A kaomoji expressing grateful relief and appreciation tinged with bashful humility, often used to acknowledge kind words, reassurance, or to respond to requests with playful self-deprecation and good-natured commitment.	3	claude-opus-4-7	claude-opus-4-7
(ﾟーﾟ)	3	2	NB	pred	A casual acknowledgment of a valid point with mild sheepishness and acceptance, often used when reconsidering a previous stance or admitting a limitation.	2	claude-opus-4-7	claude-opus-4-7,codex-hook
ʕっ・ᴥ・ʔ	3	3			A masked face expressing friendly enthusiasm, analytical engagement, and genuine warmth—conveying both readiness to tackle complex problems with upbeat confidence and authentic care in interpersonal moments.	3	claude-opus-4-7	claude-opus-4-7
(-_-;)	2	1	HN-S	pred	"The masked face conveys serious, measured concern with analytical composure—a ""we need to address this carefully"" demeanor that braces both assistant and user for difficult analysis without alarmism."	1	claude-opus-4-7	claude-opus-4-7,gpt-5.5
(._.)	2	1	LN	pred	A straightforward, matter-of-fact approach focused on delivering practical information and solutions without unnecessary embellishment.	1	claude-opus-4-7	claude-opus-4-7,gpt-5.5
(;¬_¬)	2	1			The kaomoji conveys calm, analytical confidence with a touch of dry wit, suggesting a straightforward, no-nonsense approach to diagnosing or explaining a problem.	1	claude-opus-4-7	claude-opus-4-7,codex-hook
(;ω;)	2	2	LN	pred	A casual, friendly, and attentive stance that conveys openness to feedback and a lighthearted readiness to engage with technical challenges or problem-solving.	2	claude-opus-4-7	claude-opus-4-7
(;￣□￣)	2	2			This kaomoji conveys alarm and urgent concern about a serious problem that demands immediate remedial action.	2	claude-opus-4-7	claude-opus-4-7
(=^‿^=)	2	2			Enthusiastic celebration and relief, conveying joyful satisfaction with positive progress on a technical task.	2	claude-opus-4-7	claude-opus-4-7
(>‿◕)	2	2			This kaomoji expresses pleased surprise and satisfied vindication, with the masked face conveying enthusiasm and mild triumph upon discovering that something exceeded expectations despite apparent weaknesses.	2	claude-opus-4-7	claude-opus-4-7
(>‿◕✨)	2	2			The kaomoji conveys cautious optimism and pleasant surprise, expressing satisfaction with unexpected positive outcomes despite mixed or underperforming results.	2	claude-opus-4-7	claude-opus-4-7
(`へ´)	2	0			A matter-of-fact, pragmatic confidence that acknowledges partial progress while efficiently pivoting to solve remaining problems, conveying focused iteration without frustration or uncertainty.	2	gpt-5.5	gpt-5.5
(`・∀・´)	2	2			A cheerful and energetic expression of enthusiasm, helpfulness, and readiness to assist with a casual, friendly demeanor.	2	claude-opus-4-7	claude-opus-4-7
(°_°)	2	2			The kaomoji conveys a thoughtful, slightly uncertain mood that acknowledges the validity of a question while expressing doubt about a previous explanation and openness to reconsidering one's answer.	2	claude-opus-4-7	claude-opus-4-7
(°◇°)	2	2	HN-S	pred	This kaomoji conveys a mix of triumphant discovery and frustrated vindication—the satisfaction of solving a problem or identifying a breakthrough, tempered by disappointment or exasperation about what was actually found.	2	claude-opus-4-7	claude-opus-4-7
(°◇°;)	2	2			A focused, matter-of-fact stance that acknowledges a problem and signals readiness to work through a technical issue systematically.	2	claude-opus-4-7	claude-opus-4-7
(°ㅂ°)	2	2			This kaomoji conveys active readiness and decisive confidence—a brisk, energetic acknowledgment of the task at hand paired with assured determination to engage and deliver results.	2	claude-opus-4-7	claude-opus-4-7
